slug,label,caption,vocab1,fact1,vocab2,fact2,vocab3,fact3
garage-organics,,"Hola, soy el empleado civil Kevin y trabajo en toda la ciudad. Los trabajadores de sanidad comienzan su turno registrando su entrada en su garaje local y luego salen a recoger los desechos de alimentos y de jardín que usted coloca en la acera.",,,,,,
curbside-organics,,"Los trabajadores de sanidad recogen los desechos que se pueden compostar (desechos de alimentos, hojas y ramas) de las escuelas y los hogares. Para la recogida de compost en la acera utilizamos los mismos camiones que para la basura normal o el material reciclable.",,,,,,
pile,,"Los desechos de alimentos y de jardín de toda la ciudad de Nueva York se llevan a las instalaciones regionales de compostaje, donde se convierten en compost terminado.",,¿Sabía que casi ⅓ de todo lo que tiramos en Nueva York se puede compostar? Eso significa que ⅓ de todos nuestros desechos pueden convertirse en una enmienda natural de la tierra o utilizarse para generar energía renovable.,,,,
composting,,"Equipos especiales de expertos transforman los restos de alimentos, las hojas, las ramas y el papel sucio de los alimentos en compost mediante un proceso especial. En primer lugar, mezclan la cantidad correcta de restos de alimentos, desechos de jardín y otra materia orgánica. El equilibrio adecuado de “material verde"" (elementos ricos en nitrógeno como restos de alimentos) y ""material marrón"" (elementos ricos en carbono como hojas secas o astillas de madera) garantiza que todo el material se descomponga por completo y tenga un contenido de nutrientes balanceado.",,"¿Qué es el compostaje? Al igual que los alimentos se descomponen en nutrientes y minerales en el estómago, los desechos orgánicos se descomponen gracias al trabajo de muchos organismos y procesos químicos.",,,,
organisms,,"En el transcurso de unas semanas, los restos de alimentos, las hojas y otros materiales se descomponen y se convierten en un material llamado compost. Los organismos generan mucho calor durante este proceso de descomposición. Este calor destruye las semillas de las malas hierbas y los patógenos.",,¡Las pilas de compost industriales pueden alcanzar hasta 160 °F! ¡No es deseable que la pila esté demasiado caliente durante demasiado tiempo o destruirá los microorganismos que se comen todas las verduras!,,,,
curing,,"A la larga, los alimentos y las hojas se transformarán en una pila de un material de apariencia similar a tierra oscura y quebradiza. En esta etapa, el compost necesita ""curar"" para garantizar que todos los contenidos de la pila se hayan descompuesto por completo.",,"¡A pesar de su apariencia, el compost no es lo mismo que la tierra! Más bien, el compost es algo llamado enmienda de la tierra: un fertilizante natural lleno de nutrientes de plantas descompuestas. El compost se añade a la tierra para que las plantas crezcan más sanas y fuertes.",,,,
garden,,"¡Enhorabuena! Una vez curados por completo, sus desechos orgánicos se han transformado en compost rico en nutrientes. El producto terminado luego se coloca en bolsas y se distribuye a escuelas, parques públicos, agricultores urbanos, jardineros comunitarios e incluso residentes de la ciudad de Nueva York, que pueden usarlo para cultivar sus propias frutas y verduras en casa.",,,,,,